<?xml version='1.0' encoding='UTF-8'?>
<!ELEMENT Vorlesung (Titel, Hochschule+, SWS, Semester, Kapitel+, Quelle+)>
        <!ELEMENT Titel (#PCDATA)>
        <!ELEMENT Hochschule (#PCDATA)>
        <!ELEMENT SWS (#PCDATA)>
        <!ELEMENT Semester (#PCDATA)>
        <!ELEMENT Kapitel (Name, Termin+)>
                <!ATTLIST Kapitel bewertung CDATA "1">
                <!ATTLIST Kapitel nummer CDATA #REQUIRED>
                <!ATTLIST Kapitel quelle IDREF #IMPLIED>
        <!ELEMENT Quelle (Author+, Titel)>
                <!ATTLIST Quelle id ID #REQUIRED>
                <!ATTLIST Quelle type (Monographie|Artikel|Dissertation|Abschlussarbeit) #REQUIRED>
        <!ELEMENT Author (#PCDATA)>
        <!ELEMENT Name (#PCDATA)>
        <!ELEMENT Termin (#PCDATA)>
